<?xml version="1.0" encoding ="UTF-8"?>
<!DOCTYPE DOMAINES SYSTEM "domaine.dtd">
<DOMAINES LNG="mt" VERSION="4.5"><RECORD><DOMAINE_ID>04</DOMAINE_ID><LIBELLE>POLITIKA</LIBELLE></RECORD><RECORD><DOMAINE_ID>08</DOMAINE_ID><LIBELLE>RELAZZJONIJIET INTERNAZZJONALI</LIBELLE></RECORD><RECORD><DOMAINE_ID>10</DOMAINE_ID><LIBELLE>UNJONI EWROPEA</LIBELLE></RECORD><RECORD><DOMAINE_ID>12</DOMAINE_ID><LIBELLE>DRITT</LIBELLE></RECORD><RECORD><DOMAINE_ID>16</DOMAINE_ID><LIBELLE>EKONOMIJA</LIBELLE></RECORD><RECORD><DOMAINE_ID>20</DOMAINE_ID><LIBELLE>KUMMERĊ</LIBELLE></RECORD><RECORD><DOMAINE_ID>24</DOMAINE_ID><LIBELLE>FINANZI</LIBELLE></RECORD><RECORD><DOMAINE_ID>28</DOMAINE_ID><LIBELLE>KWISTJONIJIET SOĊJALI</LIBELLE></RECORD><RECORD><DOMAINE_ID>32</DOMAINE_ID><LIBELLE>EDUKAZZJONI U KOMUNIKAZZJONI</LIBELLE></RECORD><RECORD><DOMAINE_ID>36</DOMAINE_ID><LIBELLE>XJENZA</LIBELLE></RECORD><RECORD><DOMAINE_ID>40</DOMAINE_ID><LIBELLE>IMPRIŻA U KOMPETIZZJONI</LIBELLE></RECORD><RECORD><DOMAINE_ID>44</DOMAINE_ID><LIBELLE>IMPJIEGI U KUNDIZZJONIJIET TAX-XOGĦOL</LIBELLE></RECORD><RECORD><DOMAINE_ID>48</DOMAINE_ID><LIBELLE>TRASPORT</LIBELLE></RECORD><RECORD><DOMAINE_ID>52</DOMAINE_ID><LIBELLE>AMBJENT</LIBELLE></RECORD><RECORD><DOMAINE_ID>56</DOMAINE_ID><LIBELLE>AGRIKOLTURA, FORESTRIJA U SAJD</LIBELLE></RECORD><RECORD><DOMAINE_ID>60</DOMAINE_ID><LIBELLE>PRODOTTI AGROALIMENTARI</LIBELLE></RECORD><RECORD><DOMAINE_ID>64</DOMAINE_ID><LIBELLE>PRODUZZJONI, TEKNOLOĠIJA U RIĊERKA</LIBELLE></RECORD><RECORD><DOMAINE_ID>66</DOMAINE_ID><LIBELLE>ENERĠIJA</LIBELLE></RECORD><RECORD><DOMAINE_ID>68</DOMAINE_ID><LIBELLE>INDUSTRIJA</LIBELLE></RECORD><RECORD><DOMAINE_ID>72</DOMAINE_ID><LIBELLE>ĠEOGRAFIJA</LIBELLE></RECORD><RECORD><DOMAINE_ID>76</DOMAINE_ID><LIBELLE>ORGANIZZAZZJONIJIET INTERNAZZJONALI</LIBELLE></RECORD></DOMAINES>