<?xml version="1.0" encoding ="UTF-8"?>
<!DOCTYPE DOMAINES SYSTEM "domaine.dtd">
<DOMAINES LNG="pt" VERSION="4.5"><RECORD><DOMAINE_ID>04</DOMAINE_ID><LIBELLE>ATIVIDADE POLÍTICA</LIBELLE></RECORD><RECORD><DOMAINE_ID>08</DOMAINE_ID><LIBELLE>RELAÇÕES INTERNACIONAIS</LIBELLE></RECORD><RECORD><DOMAINE_ID>10</DOMAINE_ID><LIBELLE>UNIÃO EUROPEIA</LIBELLE></RECORD><RECORD><DOMAINE_ID>12</DOMAINE_ID><LIBELLE>DIREITO</LIBELLE></RECORD><RECORD><DOMAINE_ID>16</DOMAINE_ID><LIBELLE>ECONOMIA</LIBELLE></RECORD><RECORD><DOMAINE_ID>20</DOMAINE_ID><LIBELLE>INTERCÂMBIOS ECONÓMICOS E COMERCIAIS</LIBELLE></RECORD><RECORD><DOMAINE_ID>24</DOMAINE_ID><LIBELLE>FINANÇAS</LIBELLE></RECORD><RECORD><DOMAINE_ID>28</DOMAINE_ID><LIBELLE>QUESTÕES SOCIAIS</LIBELLE></RECORD><RECORD><DOMAINE_ID>32</DOMAINE_ID><LIBELLE>EDUCAÇÃO E COMUNICAÇÃO</LIBELLE></RECORD><RECORD><DOMAINE_ID>36</DOMAINE_ID><LIBELLE>CIÊNCIAS</LIBELLE></RECORD><RECORD><DOMAINE_ID>40</DOMAINE_ID><LIBELLE>EMPRESAS E CONCORRÊNCIA</LIBELLE></RECORD><RECORD><DOMAINE_ID>44</DOMAINE_ID><LIBELLE>EMPREGO E TRABALHO</LIBELLE></RECORD><RECORD><DOMAINE_ID>48</DOMAINE_ID><LIBELLE>TRANSPORTES</LIBELLE></RECORD><RECORD><DOMAINE_ID>52</DOMAINE_ID><LIBELLE>MEIO AMBIENTE</LIBELLE></RECORD><RECORD><DOMAINE_ID>56</DOMAINE_ID><LIBELLE>AGRICULTURA, SILVICULTURA E PESCA</LIBELLE></RECORD><RECORD><DOMAINE_ID>60</DOMAINE_ID><LIBELLE>AGROALIMENTAR</LIBELLE></RECORD><RECORD><DOMAINE_ID>64</DOMAINE_ID><LIBELLE>PRODUÇÃO, TECNOLOGIA E INVESTIGAÇÃO</LIBELLE></RECORD><RECORD><DOMAINE_ID>66</DOMAINE_ID><LIBELLE>ENERGIA</LIBELLE></RECORD><RECORD><DOMAINE_ID>68</DOMAINE_ID><LIBELLE>INDÚSTRIA</LIBELLE></RECORD><RECORD><DOMAINE_ID>72</DOMAINE_ID><LIBELLE>GEOGRAFIA</LIBELLE></RECORD><RECORD><DOMAINE_ID>76</DOMAINE_ID><LIBELLE>ORGANIZAÇÕES INTERNACIONAIS</LIBELLE></RECORD></DOMAINES>