<?xml version="1.0" encoding ="UTF-8"?>
<!DOCTYPE DOMAINES SYSTEM "domaine.dtd">
<DOMAINES LNG="hu" VERSION="4.5"><RECORD><DOMAINE_ID>04</DOMAINE_ID><LIBELLE>POLITIKA</LIBELLE></RECORD><RECORD><DOMAINE_ID>08</DOMAINE_ID><LIBELLE>NEMZETKÖZI KAPCSOLATOK</LIBELLE></RECORD><RECORD><DOMAINE_ID>10</DOMAINE_ID><LIBELLE>EURÓPAI UNIÓ</LIBELLE></RECORD><RECORD><DOMAINE_ID>12</DOMAINE_ID><LIBELLE>JOG</LIBELLE></RECORD><RECORD><DOMAINE_ID>16</DOMAINE_ID><LIBELLE>KÖZGAZDASÁGTAN</LIBELLE></RECORD><RECORD><DOMAINE_ID>20</DOMAINE_ID><LIBELLE>KERESKEDELEM</LIBELLE></RECORD><RECORD><DOMAINE_ID>24</DOMAINE_ID><LIBELLE>PÉNZÜGYEK</LIBELLE></RECORD><RECORD><DOMAINE_ID>28</DOMAINE_ID><LIBELLE>TÁRSADALMI KÉRDÉSEK</LIBELLE></RECORD><RECORD><DOMAINE_ID>32</DOMAINE_ID><LIBELLE>OKTATÁS ÉS KOMMUNIKÁCIÓ</LIBELLE></RECORD><RECORD><DOMAINE_ID>36</DOMAINE_ID><LIBELLE>TUDOMÁNY</LIBELLE></RECORD><RECORD><DOMAINE_ID>40</DOMAINE_ID><LIBELLE>VÁLLALKOZÁSOK ÉS VERSENY</LIBELLE></RECORD><RECORD><DOMAINE_ID>44</DOMAINE_ID><LIBELLE>FOGLALKOZTATÁS ÉS MUNKAKÖRÜLMÉNYEK</LIBELLE></RECORD><RECORD><DOMAINE_ID>48</DOMAINE_ID><LIBELLE>KÖZLEKEDÉS</LIBELLE></RECORD><RECORD><DOMAINE_ID>52</DOMAINE_ID><LIBELLE>KÖRNYEZET</LIBELLE></RECORD><RECORD><DOMAINE_ID>56</DOMAINE_ID><LIBELLE>MEZŐGAZDASÁG, ERDÉSZET ÉS HALÁSZAT</LIBELLE></RECORD><RECORD><DOMAINE_ID>60</DOMAINE_ID><LIBELLE>AGRÁRÉLELMISZER-IPAR</LIBELLE></RECORD><RECORD><DOMAINE_ID>64</DOMAINE_ID><LIBELLE>TERMELÉS, TECHNOLÓGIA ÉS KUTATÁS</LIBELLE></RECORD><RECORD><DOMAINE_ID>66</DOMAINE_ID><LIBELLE>ENERGIA</LIBELLE></RECORD><RECORD><DOMAINE_ID>68</DOMAINE_ID><LIBELLE>IPAR</LIBELLE></RECORD><RECORD><DOMAINE_ID>72</DOMAINE_ID><LIBELLE>FÖLDRAJZ</LIBELLE></RECORD><RECORD><DOMAINE_ID>76</DOMAINE_ID><LIBELLE>NEMZETKÖZI SZERVEZETEK</LIBELLE></RECORD></DOMAINES>