<?xml version="1.0" encoding ="UTF-8"?>
<!DOCTYPE DOMAINES SYSTEM "domaine.dtd">
<DOMAINES LNG="it" VERSION="4.5"><RECORD><DOMAINE_ID>04</DOMAINE_ID><LIBELLE>VITA POLITICA</LIBELLE></RECORD><RECORD><DOMAINE_ID>08</DOMAINE_ID><LIBELLE>RELAZIONI INTERNAZIONALI</LIBELLE></RECORD><RECORD><DOMAINE_ID>10</DOMAINE_ID><LIBELLE>UNIONE EUROPEA</LIBELLE></RECORD><RECORD><DOMAINE_ID>12</DOMAINE_ID><LIBELLE>DIRITTO</LIBELLE></RECORD><RECORD><DOMAINE_ID>16</DOMAINE_ID><LIBELLE>ECONOMIA</LIBELLE></RECORD><RECORD><DOMAINE_ID>20</DOMAINE_ID><LIBELLE>SCAMBI ECONOMICI E COMMERCIALI</LIBELLE></RECORD><RECORD><DOMAINE_ID>24</DOMAINE_ID><LIBELLE>FINANZE</LIBELLE></RECORD><RECORD><DOMAINE_ID>28</DOMAINE_ID><LIBELLE>QUESTIONI SOCIALI</LIBELLE></RECORD><RECORD><DOMAINE_ID>32</DOMAINE_ID><LIBELLE>ISTRUZIONE E COMUNICAZIONE</LIBELLE></RECORD><RECORD><DOMAINE_ID>36</DOMAINE_ID><LIBELLE>SCIENZE</LIBELLE></RECORD><RECORD><DOMAINE_ID>40</DOMAINE_ID><LIBELLE>IMPRESA E CONCORRENZA</LIBELLE></RECORD><RECORD><DOMAINE_ID>44</DOMAINE_ID><LIBELLE>OCCUPAZIONE E LAVORO</LIBELLE></RECORD><RECORD><DOMAINE_ID>48</DOMAINE_ID><LIBELLE>TRASPORTO</LIBELLE></RECORD><RECORD><DOMAINE_ID>52</DOMAINE_ID><LIBELLE>AMBIENTE</LIBELLE></RECORD><RECORD><DOMAINE_ID>56</DOMAINE_ID><LIBELLE>AGRICOLTURA, SILVICOLTURA E PESCA</LIBELLE></RECORD><RECORD><DOMAINE_ID>60</DOMAINE_ID><LIBELLE>AGROALIMENTARE</LIBELLE></RECORD><RECORD><DOMAINE_ID>64</DOMAINE_ID><LIBELLE>PRODUZIONE, TECNOLOGIA E RICERCA</LIBELLE></RECORD><RECORD><DOMAINE_ID>66</DOMAINE_ID><LIBELLE>ENERGIA</LIBELLE></RECORD><RECORD><DOMAINE_ID>68</DOMAINE_ID><LIBELLE>INDUSTRIA</LIBELLE></RECORD><RECORD><DOMAINE_ID>72</DOMAINE_ID><LIBELLE>GEOGRAFIA</LIBELLE></RECORD><RECORD><DOMAINE_ID>76</DOMAINE_ID><LIBELLE>ORGANIZZAZIONI INTERNAZIONALI</LIBELLE></RECORD></DOMAINES>