<?xml version="1.0" encoding ="UTF-8"?>
<!DOCTYPE DOMAINES SYSTEM "domaine.dtd">
<DOMAINES LNG="el" VERSION="4.5"><RECORD><DOMAINE_ID>04</DOMAINE_ID><LIBELLE>ΠΟΛΙΤΙΚΗ</LIBELLE></RECORD><RECORD><DOMAINE_ID>08</DOMAINE_ID><LIBELLE>ΔΙΕΘΝΕΙΣ ΣΧΕΣΕΙΣ</LIBELLE></RECORD><RECORD><DOMAINE_ID>10</DOMAINE_ID><LIBELLE>ΕΥΡΩΠΑΪΚΗ ΕΝΩΣΗ</LIBELLE></RECORD><RECORD><DOMAINE_ID>12</DOMAINE_ID><LIBELLE>ΔΙΚΑΙΟ</LIBELLE></RECORD><RECORD><DOMAINE_ID>16</DOMAINE_ID><LIBELLE>ΟΙΚΟΝΟΜΙΚΑ</LIBELLE></RECORD><RECORD><DOMAINE_ID>20</DOMAINE_ID><LIBELLE>ΕΜΠΟΡΙΟ</LIBELLE></RECORD><RECORD><DOMAINE_ID>24</DOMAINE_ID><LIBELLE>ΔΗΜΟΣΙΟΝΟΜΙΚΑ</LIBELLE></RECORD><RECORD><DOMAINE_ID>28</DOMAINE_ID><LIBELLE>ΚΟΙΝΩΝΙΚΑ ΘΕΜΑΤΑ</LIBELLE></RECORD><RECORD><DOMAINE_ID>32</DOMAINE_ID><LIBELLE>ΕΚΠΑΙΔΕΥΣΗ ΚΑΙ ΕΠΙΚΟΙΝΩΝΙΕΣ</LIBELLE></RECORD><RECORD><DOMAINE_ID>36</DOMAINE_ID><LIBELLE>ΕΠΙΣΤΗΜΕΣ</LIBELLE></RECORD><RECORD><DOMAINE_ID>40</DOMAINE_ID><LIBELLE>ΕΠΙΧΕΙΡΗΣΕΙΣ ΚΑΙ ΑΝΤΑΓΩΝΙΣΜΟΣ</LIBELLE></RECORD><RECORD><DOMAINE_ID>44</DOMAINE_ID><LIBELLE>ΑΠΑΣΧΟΛΗΣΗ ΚΑΙ ΣΥΝΘΗΚΕΣ ΕΡΓΑΣΙΑΣ</LIBELLE></RECORD><RECORD><DOMAINE_ID>48</DOMAINE_ID><LIBELLE>ΜΕΤΑΦΟΡΕΣ</LIBELLE></RECORD><RECORD><DOMAINE_ID>52</DOMAINE_ID><LIBELLE>ΠΕΡΙΒΑΛΛΟΝ</LIBELLE></RECORD><RECORD><DOMAINE_ID>56</DOMAINE_ID><LIBELLE>ΓΕΩΡΓΙΑ, ΔΑΣΟΚΟΜΙΑ ΚΑΙ ΑΛΙΕΙΑ</LIBELLE></RECORD><RECORD><DOMAINE_ID>60</DOMAINE_ID><LIBELLE>ΓΕΩΡΓΙΚΑ ΠΡΟΪΟΝΤΑ ΔΙΑΤΡΟΦΗΣ</LIBELLE></RECORD><RECORD><DOMAINE_ID>64</DOMAINE_ID><LIBELLE>ΠΑΡΑΓΩΓΗ, ΤΕΧΝΟΛΟΓΙΑ ΚΑΙ ΕΡΕΥΝΑ</LIBELLE></RECORD><RECORD><DOMAINE_ID>66</DOMAINE_ID><LIBELLE>ΕΝΕΡΓΕΙΑ</LIBELLE></RECORD><RECORD><DOMAINE_ID>68</DOMAINE_ID><LIBELLE>ΒΙΟΜΗΧΑΝΙΑ</LIBELLE></RECORD><RECORD><DOMAINE_ID>72</DOMAINE_ID><LIBELLE>ΓΕΩΓΡΑΦΙΑ</LIBELLE></RECORD><RECORD><DOMAINE_ID>76</DOMAINE_ID><LIBELLE>ΔΙΕΘΝΕΙΣ ΟΡΓΑΝΙΣΜΟΙ</LIBELLE></RECORD></DOMAINES>